adl_id,date,city,state,description
10951,12/31/19,Eagleswood Township,NJ,"New Jersey European Heritage Association, an alt right group, distributed propaganda."
12287,12/28/19,New Bern,NC,"A man trespassed Temple B'nai Sholem and put a sticker on the door which read, ""IT'S OKAY TO BE WHITE."""
12256,12/23/19,Somerville,NJ,"Daily Stormer Book Club, an alt right group, left anti-immigrant fliers in the free lending library of a Jewish organization."
11066,12/21/19,West Memphis,AR,"New Jersey European Heritage Association, an alt right group, distributed propaganda that read: ""Nationalism is nature,"" ""Stand your ground,"" ""No more wars for Israel,"" and ""Diversity means no white neighborhoods."""
11102,12/18/19,West Orange,NJ,"New Jersey European Heritage Association, an alt right group, distributed propaganda that read: ""Deport all 20 million illegal aliens,"" ""This is our land,"" ""Defend our borders,"" and ""Demand a real investigation of USS Liberty attack June 8th 1967 Israeli sneak attack against Americans!"""
11106,12/16/19,Olean,NY,"An unknown person or group painted swastikas and AWD, the acronym for Atomwaffen Division, on a U.S. military recruitment office and the Olean Public Library."
11250,12/16/19,Richmond,VA,Members of the alt right Patriot Front held a flash demonstration outside the Virginia Israel Advisory Board.
11121,12/15/19,South Orange Village,NJ,"New Jersey European Heritage Association, an alt right group, distributed fliers with the QR code for New Jersey European Heritage Association and propaganda that read: ""America belongs to Americans,"" ""Reclaim America,"" ""Reclaim your nation reclaim your heritage,"" and ""Demand a real investigation of USS Liberty attack June 8th 1967 Israeli sneak attack against Americans!"""
11123,12/14/19,Conshohocken,PA,"New Jersey European Heritage Association, an alt right group, distributed propaganda that read: ""Deport illegal aliens they are criminal invaders,"" ""Reclaim your nation reclaim your heritage,"" and ""Demand a real investigation of USS Liberty attack June 8th 1967 Israeli sneak attack against Americans!"""
11126,12/14/19,Philadelphia,PA,"New Jersey European Heritage Association, an alt right group, distributed propaganda in the Roxborough neighborhood that read: ""Deport illegal aliens they are criminal invaders,"" ""Remember the USS Liberty 1967 Israeli attack against America,"" and ""Reclaim your nation reclaim your heritage."""
11251,12/10/19,Jersey City,NJ,"David Anderson and Francine Graham, apparent adherents of the Black Hebrew Israelite movement, embarked upon a shooting spree and shootout with police that left one police officer and three civilians dead, as well as the perpetrators. The attack is under investigation but may be motivated by anti-police and anti-Semitic animus. The two are also suspects in a separate murder that occurred days before the attack."
11175,12/7/19,Philadelphia,PA,"New Jersey European Heritage Association, an alt right group, distributed fliers that read: ""Remember the USS Liberty 1967 Israeli attack against America."""
11223,12/2/19,Torrance,CA,"Iron Youth, a white supremacist group, distributed recruitment propaganda with anti-Semitic imagery that read: ""Christian vigilantes arise boycott the movies"" and ""Imagine getting thrown out of 109 bars getting fired by 109 jobs getting dumped by 109 relationship partners and never even once considering the possibility that it might be your own fault."""
11224,12/2/19,Spokane,WA,"Feuerkrieg Division, a neo-Nazi group, distributed propaganda featured a yellow Star of David and ""Jew."" The flier read: ""We cast bullets - not ballots."""
12130,12/1/19,Austin,TX,"Anti-Semitic and racist graffiti was found at Balcones Wood Park. the graffiti included swastikas, a crossed out Star of David, the n-word, and the message ""The Goyim Know."""
12131,12/1/19,Boca Raton,FL,Jewish high school student victim of ongoing anti-Semitic harassment and bullying by classmate.
12132,12/1/19,Brooklyn,NY,"Jewish woman was verbally harassed and threatened in a subway station by a woman who said to her, ""You fucking Jew lady with the wig, I'm going to throw you on the tracks."""
12133,12/1/19,Brooklyn,NY,"A Jewish woman was verbally harassed and referred to as ""the fucking Jew with the wig"" while waiting on the subway platform in Crown Heights."
12134,12/1/19,Glen Cove,NY,"For the second time in two weeks, the Holocaust Memorial and Tolerance Center in Nassau County was vandalized with graffiti that included swastikas."
12135,12/1/19,Plainfield,IL,"After a Jewish student brought a menorah to school for Hanukkah, a classmate passed him a note with a swastika on it."
12136,12/1/19,Northampton,MA,Confidential
12137,12/1/19,Norton,MA,A swastika was traced in the snow on a sign at Wheaton College.
12138,12/1/19,Summit,NJ,Jewish center received an alarming email.
12139,12/1/19,Astoria,NY,Congresswoman's office door was vandalized with swastika graffiti.
12140,12/1/19,Wrightwood,CA,Several cars and a garage were vandalized with swastika graffiti in a residential neighborhood.
12141,12/1/19,Milwaukee,WI,Two swastikas were drawn inside a city bus.
12142,12/1/19,Chicago,IL,Customer at a nail salon was told that Jews control Poland and benefit from the Holocaust.
12143,12/1/19,Deer Park,NY,Private business received three copies of an anti-Semitic letter.
12144,12/1/19,New York,NY,"Clothing store vandalized with graffiti that read ""Kill the Jews."""
12145,12/1/19,San Francisco,CA,"A Jewish student was harassed by her peers who told her ?you?re just being greedy and wanting attention because you are a Jew."""
12146,12/1/19,Binghamton,NY,A swastika as painted in the snow.
12147,12/1/19,Los Angeles,CA,Jewish individual harassed by passerby.
12148,12/1/19,Marysville,OH,Art teacher allowed a student to draw a swastika as an ornament on a class Christmas tree.
12149,12/1/19,Reno,NV,"A flier was posted at the University of Nevada at Reno that compared university professors to the ""mostly Jewish and wealthy elites"" that rejected Adolf Hitler from the Vienna Academy of Arts by alleging that certain university educators were ""denying"" students degrees because of those students being ""Christians, political conservatives or simply supporting the U.S. Constitution."
12150,12/1/19,Tempe,AZ,Confidential
12151,12/1/19,Huntington,WV,Posters in an academic building at Marshall University were defaced with swastika graffiti.
12152,12/1/19,Bloomington,IN,A rock in front of the Theta Chi fraternity at Indiana University was vandalized with a spray-painted swastika.
12153,12/1/19,Brooklyn,NY,"A Jewish man walking on the street was approached by an unknown person who yelled ""Heil Hitler"" at him."
12154,12/1/19,Encinitas,CA,"Anti-Semitic and homophobic graffiti was discovered at San Dieguito Academy. The graffiti included photoshopped images of Jewish faculty members or faculty members with Jewish surnames, superimposed on images of Nazis."
12155,12/1/19,Minneapolis,MN,"Jewish organization received a letter that read ""Islam is Right About Jews,"" with quotes about killing Jews."
12156,12/1/19,Worcester,MA,Swastika vandalism was discovered in a restroom in the Learning Resource Center at Worcester State University.
12157,12/1/19,Neptune Township,NJ,Trees on a residential property were vandalized with swastika graffiti.
12158,12/1/19,Airmont,NY,Confidential
12159,12/1/19,Concord,CA,Confidential
12160,12/1/19,New York,NY,A synagogue was defaced with an image of a dollar bill with what appears to be an image of a pig in the center.
12161,12/1/19,Santa Ynez,CA,Swastikas were spray-painted onto buildings at Santa Ynez High School.
12162,12/1/19,Edison,NJ,A woman discovered that a swastika had been spray-painted on part of her property.
12163,12/1/19,Lawrence,NY,"A Jewish man shopping at Costco was called a ""fucking Jew"" and told ""the Nazis will fucking kill you"" by another customer."
12164,12/1/19,New York,NY,Individual received an anti-Semitic email at their place of business.
12165,12/1/19,Sarasota,FL,A Jewish genealogical website received a harassing and threatening anti-Semitic email to their general email account.
12166,12/1/19,Toluca Lake,CA,A Star of David with a swastika in the center was drawn on a freeway underpass at an intersection.
12167,12/1/19,Garden Grove,CA,Jewish student harassed on the basketball court by an opposing player.
12168,12/1/19,Los Angeles,CA,A student defaced school property with a swastika drawing.
12169,12/1/19,Northridge,CA,An apartment building was defaced with swastika graffiti.
12170,12/1/19,Northridge,CA,An apartment building was defaced with swastika graffiti.
12171,12/1/19,Palm Beach Gardens,FL,Jewish student at a high school was victim of verbal anti-Semitic harassment by a peer.
12172,12/1/19,Santa Monica,CA,A desk in a classroom at Santa Monica College was defaced with threatening anti-Semitic graffiti.
12173,12/1/19,Manchester,VT,A school desk was vandalized with a drawing of a swastika.
12174,12/1/19,Houston,TX,Holocaust denial messages were sent to a Holocaust museum's LinkedIn page.
12175,12/1/19,Austin,TX,"A sticker that read, ""Free Palestine, End the Occupation,"" was placed on the window of a car belonging to a student at a Jewish sorority at UT Austin."
12176,12/1/19,Parsippany-Troy Hills Township,NJ,A synagogue received an anti-Semitic conspiratorial email.
12177,12/1/19,Upper Saddle River,NJ,Students on a school bus traced swastikas into the condensation on the windows.
12178,12/1/19,Brooklyn,NY,"Jewish woman found a note on her door that read ""Nosy Jew."""
12179,12/1/19,Canon City,CO,Jewish employee harassed by co-worker making anti-Semitic comments.
12180,12/1/19,East Garden City,NY,Anti-Semitic voicemail left at a place of business.
12181,12/1/19,Foster City,CA,"A Jewish center received a call from someone who stated, ""Nobody cares about the Holocaust."""
12182,12/1/19,New York,NY,Individual in Inwood made an anti-Semitic remark.
12183,12/1/19,Los Angeles,CA,Business received a harassing and anti-Semitic phone call.
12184,12/1/19,Minneapolis,MN,"Synagogue received a letter that read ""Islam is Right About Jews,"" with quotes about killing Jews."
12185,12/1/19,New Rochelle,NY,"School officials at Albert Leonard Middle School reported that ""anti-Semitic language"" had been found written on the school playground."
12186,12/1/19,Houston,TX,A synagogue received a harassing phone call from an individual blaming Jews for starting wars.
12187,12/1/19,Jersey City,NJ,"A woman blamed Jews and ""Jew shenanigans"" for the shooting at a kosher market in Jersey City, and the subsequent inconveniences to her community."
12188,12/1/19,Montclair,NJ,Three swastikas were found on desks in a classroom at Montclair High School.
12189,12/1/19,Brooklyn,NY,Confidential
12190,12/1/19,Brooklyn,NY,Swastika vandalism discovered in a school.
12191,12/1/19,Teaneck,NJ,"Driver in a car passing a synagogue yelled ""Sieg Heil."""
12192,12/1/19,Brooklyn,NY,A man was arrested for brandishing what turned out to be a fake gun at a Jewish man in Boro Park.
12193,12/1/19,Jacksonville,FL,Jewish student at a middle targeted by a classmate with anti-Semitic verbal harassment.
12194,12/1/19,New York,NY,A metal beam in a subway station was vandalized with swastika graffiti.
12195,12/1/19,San Diego,CA,Jewish elementary school student told by classmate that they couldn't play together because her father hates Jews and does not want Jews in his house.
12196,12/1/19,Sherman Oaks,CA,"""Heil Hitler"" was spray-painted on the sidewalk outside a synagogue."
12197,12/1/19,Sherman Oaks,CA,Swastika vandalism on sidewalk.
12198,12/1/19,St. Louis,MO,Individual received a harassing anti-Semitic direct message via Facebook.
12199,12/1/19,Saint Paul,MN,"Jewish organization received a letter that read ""Islam is Right About Jews,"" with quotes about killing Jews."
12200,12/1/19,Wilbraham,MA,A Jewish high school student was added to a Snapchat group with a swastika as the group name. Members of this Snapchat group subsequently sent anti-Semitic images and messages to the Jewish student.
12201,12/1/19,Charleston,SC,"Jewish student at a middle school harassed by peers who told her she had a ""big Jewish nose."""
12202,12/1/19,Hazlet,NJ,High school student directed the Nazi salute at other students.
12203,12/1/19,Bradenton,FL,Confidential
12204,12/1/19,Winchester,MA,Students were sent a photo of another student wearing a mask with a swastika drawn on it via Snapchat.
12205,12/1/19,Asheville,NC,Confidential
12206,12/1/19,Asheville,NC,Confidential
12207,12/1/19,Chapel Hill,NC,"UNC Chapel Hill reported that anti-Semitic, racist, and sexist words and symbols were found written in dorms."
12208,12/1/19,Thermopolis,WY,"Messianic symbols and the words ""repent you,"" a cross, and a ""do not"" slash through the menorah of the Messianic symbol were drawn outside a Jewish-owned business"
12209,12/1/19,Beverly Hills,CA,"Nessah Synagogue was broken into and vandalized. Prayer shawls, Torah scrolls, and prayer books were left strewn and desecrated."
12210,12/1/19,Huntington Woods,MI,Confidential
12211,12/1/19,Oceanside,NY,Individual made verbal anti-Semitic threats.
12212,12/1/19,Wantagh,NY,Coins were left outside a Jewish family's home in an attempt to harass them.
12213,12/1/19,Lakewood,NJ,"Jewish individual was referred to as a ""fucking Jew."""
12214,12/1/19,Columbus,OH,Jewish woman being harassed with anti-Semitic messages via direct messages in Facebook and YouTube.
12215,12/1/19,Rockaway,NJ,A Jewish organization received a harassing anti-Semitic voicemail from an individual who referenced the Jersey City shooting of a kosher market.
12216,12/1/19,South Brunswick Township,NJ,"Individual made harassing, anti-Semitic, and racist phone calls."
12218,12/1/19,Tarzana,CA,A sidewalk was vandalized with swastika graffiti.
12219,12/1/19,Boston,MA,"Jewish organization received an anti-Semitic and anti-Israel email saying ""Jews and their enablers make principled, moral Americans complicit in Israel's barbaric, pernicious, vile, evil abuse of Palestinians."
12220,12/1/19,Jersey City,NJ,"A white canvas board with anti-Semitic messages including ""6 million more"" and ""let him finish the job"" was left outside a Jewish institution."
12221,12/1/19,Lakewood,NJ,"""Hitler did nothing wrong"" was written on a whiteboard in a Jewish school."
12222,12/1/19,Los Angeles,CA,Swastika graffiti discovered at an elementary school.
12223,12/1/19,New York,NY,Toilet paper was used to fashion a swastika and left in the bathroom at a high school.
12224,12/1/19,Northridge,CA,Various buildings were defaced with swastika graffiti.
12225,12/1/19,Boston,MA,Elected official received an anti-Semitic and threatening phone message.
12226,12/1/19,Needham,MA,School administrators at Mitchell Elementary School reported that an anti-Semitic incident had occurred between fifth-grade students.
12227,12/1/19,Parsippany-Troy Hills Township,NJ,Confidential
12228,12/1/19,Brooklyn,NY,A woman on the street made anti-Semitic remarks and verbal threats to Jews.
12229,12/1/19,Irvine,CA,A high school student was the victim of ongoing anti-Semitic Holocaust jokes by a classmate.
12230,12/1/19,Los Angeles,CA,A Facebook user posted anti-Semitic messages in a Jewish Facebook group.
12231,12/1/19,Los Angeles,CA,A bus advertisement was vandalized with swastika graffiti.
12232,12/1/19,Oakland,NJ,"Jewish student victim of ongoing anti-Semitic harassment threats by classmate who said she should be ""gassed,"" and called her a ""Jewish piece of shit."""
12233,12/1/19,Voorhees,NJ,A student discovered a swastika had been scratched onto a gym locker.
12235,12/1/19,Deerfield,IL,"During a verbal altercation one neighbor referred to the other as a ""fucking Jew."""
12236,12/1/19,Los Angeles,CA,"During a dispute, a tenant called their landlord a ""fucking Jew."""
12237,12/1/19,Minneapolis,MN,Jewish campus organization received a conspiratorial anti-Semitic email.
12238,12/1/19,Philadelphia,PA,"Jewish woman discovered that a swastika and the message, ""die scum"" had been spray-painted on the exterior of her apartment."
12239,12/1/19,Seal Beach,CA,A community Hannukah menorah in residential community was vandalized.
12240,12/1/19,Roxbury Township,NJ,"A swastika and ""Hitler"" were spray-painted on a water basin in a park."
12241,12/1/19,Upper Saddle River,NJ,A student discovered that a swastika had been drawn on the classroom white board.
12242,12/1/19,Los Angeles,CA,Jewish individual verbally harassed with anti-Semitic remarks by passerby.
12243,12/1/19,Minnetonka,MN,Students were heard making Holocaust jokes in school.
12244,12/1/19,San Diego,CA,"A Jewish student at an elementary school was told by a classmate that he hates all Jews because Jews ""kill my people."""
12245,12/1/19,Santa Rosa,CA,Confidential
12246,12/1/19,Bloomfield Hills,MI,"Individual received emails with anti-Semitic messages and conspiracies, including claiming Jews control Hollywood and that Israel was responsible for the 9/11 terrorist attacks."
12247,12/1/19,Canyon Country,CA,Neighbor made an anti-Semitic and disparaging remark about Jews and Christmas.
12248,12/1/19,Mount Pleasant,SC,An adolescent boy was harassed for being Jewish by a peer at a community basketball court. The boy was told that his family should have been killed in the Holocaust so that he would not be alive today.
12249,12/1/19,Princeton,NJ,A restroom at Princeton University was vandalized with a threatening anti-Semitic message.
12250,12/1/19,Oceanside,NY,"Jewish institution received a phone call from someone who told them to ""go back to Auschwitz."""
12251,12/1/19,St. Louis,MO,Jewish campus organization received an anti-Semitic email.
12252,12/1/19,Elmwood Park,NJ,Three swastikas were found carved on playground equipment.
12253,12/1/19,Brooklyn,NY,Two Orthodox Jewish children were assaulted inside their apartment building in Williamsburg.
12254,12/1/19,New York,NY,A Jewish organization received a harassing and threatening anti-Semitic phone call.
12255,12/1/19,New York,NY,"A Jewish man was physically assaulted and allegedly told, ""Fuck you, Jew"" by the suspect."
12257,12/1/19,Helena-West Helena,AR,Jewish individual victim of ongoing anti-Semitic harassment and threats at his home in West Helena.
12258,12/1/19,Billerica,MA,A storage bin was vandalized with swastika graffiti.
12259,12/1/19,Brooklyn,NY,"CCTV shows an Orthodox Jewish man walking down the street in Crown Heights past a group of men then a man from the group, unprovoked, threw a chair at him."
12260,12/1/19,Brooklyn,NY,"In Crown Heights, around 2 AM, a group of individuals chased an Orthodox man, yelling ""Fuck you Jew"" and then threw a slushy at him."
12261,12/1/19,Brooklyn,NY,"In Crown Heights during the evening, a group of individuals approached an Orthodox man on the street, punched him the back of the head and fled."
12262,12/1/19,Far Rockaway,NY,"An individual spat on a Jewish woman sitting in her car and said ""I'm going to kill all the Jews."""
12263,12/1/19,Wallingford,PA,"A Jewish man received an anonymous text message that read, ""See you soon, kike."""
12264,12/1/19,St. Albans,VT,"Signs reading, ""ITS [sic] OKAY TO BE ANTI-SEMITIC"" were stapled to telephone poles in downtown St. Albans."
12265,12/1/19,Asheville,NC,A mural on the building of Static Age Records was vandalized with a spray-painted swastika.
12266,12/1/19,Brooklyn,NY,A corner deli shop was vandalized with swastika graffiti in Greenpoint.
12267,12/1/19,Brooklyn,NY,A Jewish man in Boro Park was punched after trying to walk around an individual intentionally blocking his path.
12268,12/1/19,Brooklyn,NY,An Orthodox Jewish man was chased down a street in Williamsburg and punched in the face.
12269,12/1/19,Hot Springs,AR,The Hot Springs Police Department reported that a man vandalized a Hannukah menorah display.
12270,12/1/19,St. Louis Park,MN,Jewish individual's car was vandalized with swastika graffiti.
12271,12/1/19,Charlotte,NC,Confidential
12272,12/1/19,Montclair,NJ,A public menorah was vandalized in Montclair.
12273,12/1/19,Teaneck,NJ,"A man entered a bagel shop and shouted anti-Semitic slurs, subsequently a physical altercation took place and a victim was scratched in the face."
12274,12/1/19,Brooklyn,NY,A Jewish woman and her son were attacked by a woman who yelled anti-Semitic slurs and hit the mother in the head.
12275,12/1/19,Granada Hills,CA,Swastikas were spray-painted onto the sidewalk.
12276,12/1/19,Pawling,NY,"Off the interstate highway, a group of people were holding signs that read ""Jews Want Your Guns."""
12277,12/1/19,Philadelphia,PA,A swastika was drawn into wet cement on the street.
12278,12/1/19,Santa Fe,NM,"Tenant made an anti-Semitic remark to rental management, who are Jewish, saying ""Hitler took care of a lot of things, but he left you two out."""
12279,12/1/19,Groton,CT,An anti-Semitic joke was directed at a Jewish individual.
12280,12/1/19,Brooklyn,NY,A Jewish teenager walking in the Flatbush neighborhood of Brooklyn was verbally harassed with anti-Semitic slurs by two people who also brandished a knife at the teen.
12281,12/1/19,Brooklyn,NY,A man wearing a hoodie entered the Chabad Lubavitch World Headquarters in Brooklyn and threatened to open fire with a gun before escaping to the subway.
12282,12/1/19,Brooklyn,NY,"Three Jewish women in Crown Heights were allegedly slapped by an individual on the street who yelled, ""Fuck you Jew."""
12283,12/1/19,Gainesville,FL,Mezuzahs on at least two apartments in off campus housing at the University of Florida were vandalized.
12284,12/1/19,Hoffman Estates,IL,"A man yelled ""Sieg Heil"" at a group of Jewish worshipers leaving a synagogue."
12285,12/1/19,Wilton Manors,FL,A synagogue received anti-Semitic and homophobic messages through their general online contact form.
12286,12/1/19,Mendham,NJ,A large public menorah belonging to Mendham Borough Park was vandalized during the holiday of Hannukah.
12288,12/1/19,Holly,MI,A tree in a public park was vandalized with swastika graffiti.
12289,12/1/19,Monsey,NY,"A man walked into the home of a rabbi, where a Hanukkah celebration was taking place, and began stabbing people. At least five people were injured in the attack."
12290,12/1/19,Philadelphia,PA,Jewish family harassed at their home by a group of teenagers.
12291,12/1/19,Philadelphia,PA,"Protesters were seen holding signs that read ""Bad Jews: They are going to Hell."""
12292,12/1/19,Baltimore,MD,Driver through a cup of soda at a Jewish man walking to synagogue.
12293,12/1/19,Seattle,WA,"Individual was shoved and called a ""Dirty Old Jew."""
12294,12/1/19,Howell Township,NJ,"""Burn Jews"" and a swastika were spray-painted on trees in a wooded area."
12295,12/1/19,Brooklyn,NY,Swastika vandalism discovered on a park bench in Marine Park Salt Marsh Nature Center.
12296,12/1/19,Davie,FL,Jewish teenager verbally harassed with anti-Semitic messages by another player on a gaming app.
12297,12/1/19,Great Neck,NY,"Someone called a business and told them to ""go back to Auschwitz."""
12298,12/1/19,Marina del Ray,CA,"A waiter at a restaurant told a patron that Jews are a ""cancerous people."""
12299,12/1/19,West Hollywood,CA,"The Bayou WeHo, a restaurant and bar, was vandalized with graffiti that read ""Hitler was right."""
12300,12/1/19,Brooklyn,NY,Faculty and staff at Brooklyn College received an email promoting anti-Semitic literature and conspiracies.
12301,12/1/19,Lake Zurich,IL,A large swastika was spray-painted on the exterior wall at Seth Paine Elementary School.
12302,12/1/19,New York,NY,Swastika vandalism was discovered on apartment doors in an Upper West Side apartment building.
12303,12/1/19,North Merrick,NY,Swastika vandalism discovered on a school playground.
12304,12/1/19,Reston,VA,Confidential
12306,12/1/19,Boulder,CO,Swastikas were spray-painted on a storage unit outside a person's home.
12307,12/1/19,Brooklyn,NY,A Jewish man was verbally threatened and harassed with anti-Semitic slurs on the street by a three men walking by.
12308,12/1/19,Brooklyn,NY,A Jewish teenager was verbally harassed with anti-Semitic slurs and subsequently robbed of his earbuds and yarmulke at knife point while riding an MTA bus.
12309,12/1/19,Brooklyn,NY,A man and woman forcefully grabbed an orthodox Jewish woman's wig.
12310,12/1/19,Los Angeles,CA,"A restaurant received a phone call from someone who yelled, ""You fucking Jew."""
12311,12/1/19,New York,NY,An MTA flier was cut up into the shape of a swastika and affixed to an elevator in a subway station.
12312,12/1/19,New York,NY,Confidential
12313,12/1/19,Whitefish Bay,WI,A large public menorah was vandalized.
12123,11/28/19,Bryn Mawr,PA,"New Jersey European Heritage Association, an alt right group, posted fliers in an alley that read: ""Reclaim your nation reclaim your heritage"" and ""Remember the USS Liberty."""
10658,11/21/19,Isla Vista,CA,"Feuerkrieg Division, a neo-Nazi group, posted propaganda at University of California Santa Barbara that read: ""Screw your optics join the Feuerkrieg Division,"" ""Men against time Feuerkrieg Division,"" ""Take pigs to the slaughter house,"" ""This time the world,"" and ""Strew the streets with the bodies of bureaucrats."""
10663,11/20/19,Bordentown,NJ,"New Jersey European Heritage Association, an alt right group, distributed fliers that read: ""Stop the invasion caravan defend America,"" ""Troops to the border now,"" ""Troops to the border,"" ""No communism in America,"" and ""Demand a real investigation of USS Liberty attack June 8th 1967 Israeli sneak attack against Americans!"""
