adl_id,date,city,state,description
6193,7/1/18,Gallup,NM,An anti-Semitic Facebook page sent anti-Semitic messages to a Jewish Facebook user.
6194,7/1/18,Woodmere,NY,"A Jewish woman was refused service by a cashier who told her, and another customer, ""I am not taking her. She is Jewish."""
6195,7/1/18,New York,NY,"A public radio station featured anti-Semites Kevin Barrett, Gilad Atzmon, and Philip Giraldo. The show's host told listeners, and the guests, that ""Judeophobia is justified."""
6196,7/1/18,Omaha,NE,"An unknown person or group, distributed anti-Semitic Nazi-era pamphlets to Little Free Libraries that had been translated into English and published."
6197,7/1/18,Dunwoody,GA,A Jewish organization received a harassing and anti-Semitic email.
6198,7/1/18,Wellsboro,PA,"A customer was repeatedly called ""a dirty New York Jew"" during a business disagreement."
6199,7/1/18,La Jolla,CA,"While walking home from synagogue, a Jewish man was called a ""kike"" by a passerby."
6200,7/1/18,Seattle,WA,A Jewish woman was targeted with an anti-Semitic meme on Twitter.
6201,7/1/18,Omaha,NE,"An unknown person or group, distributed anti-Semitic Nazi-era pamphlets to Little Free Libraries that had been translated into English and published."
6202,7/1/18,Brooklyn,NY,"While walking on the street, a Jewish man was called a ""fucking Jew"" and threatened."
6203,7/1/18,Barnstable,MA,"Jewish woman discovered a bag on her property with an expletive and ""Jew"" written on it."
6204,7/1/18,San Francisco,CA,A synagogue received an anti-Semitic and harassing letter in the mail.
6205,7/1/18,Chicago,IL,"Individual on public transportation was yelling ""Heil Hitler"" at other passengers."
6206,7/1/18,Omaha,NE,An unknown person or group distributed anti-Semitic Nazi-era pamphlets to Little Free Libraries that had been translated into English and published.
6207,7/1/18,Gainesville,VA,Anti-Semitic KKK flyers were found outside homes in a residential neighborhood.
6208,7/1/18,Bristow,VA,Anti-Semitic KKK flyers were found outside homes in a residential neighborhood.
6209,7/1/18,Chevy Chase,MD,Anti-Semitic flyers from the conspiracy theorist Peter Cojanis were discovered outside homes in a residential neighborhood.
6210,7/1/18,Maryland City,MD,An unknown person distributed anti-Semitic flyers attributed to Peter Cojanis. 
6211,7/1/18,Miami Beach,FL,"Police arrested an individual who made credible threats to burn down his apartment building with ""all the fucking Jews."""
6212,7/1/18,Spring Valley,NY,"Individual sent an email to a former employer calling them ""dirty Jewish bastards."""
6213,7/1/18,Brooklyn,NY,"While at an intersection, a Jewish man was called a ""fucking Jew"" repeatedly by a passenger in another car."
6214,7/1/18,Miami,FL,Cashier at a store made a disparaging comment about the customer being Jewish.
6215,7/1/18,Lake Como,PA,"At a sleepaway camp, campers arranged water bottles into the shape of a swastika on the bed of a Jewish camper."
6216,7/1/18,Seattle,WA,A woman and her child were verbally accosted outside their home by an individual who yelled anti-Semitic slurs at them that Jews are cheap.
6217,7/1/18,Roswell,GA,Confidential
6218,7/1/18,Denver,CO,Confidential
6219,7/1/18,Brookline,MA,"Jewish individual received anti-Semitic, pro-BDS postcard of a cartoon depicting Jewish and Israeli control over American foreign policy."
6220,7/1/18,Pittsfield,NH,Individual sent anti-Semitic text message.
6221,7/1/18,Aurora,CO,"During a homeowner dispute, one neighbor called the other neighbor a ""kike"" and told him that ""where I come from we get a rope and hang you guys."""
6222,7/1/18,Walnut Creek,CA,High school student drew a swastika on his phone and showed it to his Jewish classmate.
6223,7/1/18,San Francisco,CA,"Jewish organization received an anti-Semitic call from the Road to Power on behalf of John Fitzgerald. The recording said that ""Your vote for John Fitzgerald means no more U.S. wars for Israel based on their lies like the Jewish conducted attack on 9/11. Your vote for John Fitzgerald means no more sacrificing the lives and limbs of our children for Israel."""
6224,7/1/18,Chautauqua,NY,Individual hung a Nazi flag to harass their neighbor.
6225,7/1/18,Sagle,ID,"Individual received an anti-Semitic robocall from neo-Nazi Patrick Little, in which he spoke about getting rid of Jews in America."
6226,7/1/18,Cambridge,MA,Individual received anti-Semitic messages after publishing a commentary on the bible.
6227,7/1/18,Brooklyn,NY,"Individual was verbally harassed by a group of people who told the victim ""You Jews are buying up all the buildings."""
6228,7/1/18,Lansdale,PA,"During a sermon, a priest made anti-semitic claims about Jewish liturgy."
6229,7/1/18,Providence,RI,"Neo-Nazi Patrick Little, was on the Brown University campus making anti-Semitic remarks and statements."
6230,7/1/18,Philadelphia,PA,"At a summer camp, campers played a game in which they forced their peers to wear a makeshift yarmulke, and told them to touch a cross if they did not want to be ""converted"" to Judaism."
6231,7/1/18,Los Angeles,CA,"A Jewish restaurant owner was targeted and verbally harassed because of his pro-Trump stance. Protesters with an anti-gentrification group called him a ""dirty Jew."""
6232,7/1/18,Waltham,MA,Individual subjected to anti-Semitic remarks in the workplace by coworkers.
6233,7/1/18,Newton,MA,"Jewish couple victims of anti-Semitic harassment by their neighbor who called them ""fucking Jews"" and wished ""the Holocaust would be back."""
6234,7/1/18,Skokie,IL,"Patrick Little, a white supremacist and former candidate for the US Senate, was found picketing outside the Skokie Holocaust Museum with an anti-Semitic sign that read: ""Jews Rape Kids."""
6235,7/1/18,Milwaukee,IL,Jewish individual targeted online with anti-Semitic comments.
6236,7/1/18,Madison,WI,Synagogue received an anti-Semitic voice mail.
6237,7/1/18,Lincoln,NE,"An unknown person or group, distributed anti-Semitic Nazi-era pamphlets to Little Free Libraries that had been translated into English and published."
6238,7/1/18,Minneapolis,MN,"K-12 student posted a video of another student saying: ""I don't like Jewish people. I don't like Jewish people because they feel entitled because of the Holocaust."" "
6239,7/1/18,Washington,DC,Jewish institution received a bomb threat.
6240,7/1/18,West Hills,CA,Confidential
6241,7/1/18,Panorama City,CA,"Individual at a gas station was approached by another person who threatened to kill him while screaming ""fucking Jews."""
6242,7/1/18,Oakland,CA,"An instructor at Merritt College made disparaging, anti-Semitic comment."
6243,7/1/18,Miami,FL,Anti-Semitic harassment in the workplace.
6244,7/1/18,Port Washington,NY,"Radio show guest claimed that photos of WWII concentration camp Dachau were doctored by US government, and that Zionists manufactured and exaggerated the Holocaust in an effort to win preferential treatment."
6245,7/1/18,Olympia,WA,"Neo-Nazi Patrick Little stopped in Olympia on his ""Name the Jew"" tour where he walked around and attempted to engage passersby with his anti-Semitic ideology and conspiracy theories."
6246,7/1/18,Seattle,WA,"Neo-Nazi Patrick Little was in Seattle for his ""Name the Jew"" tour where he attempted to engage passersby on the street with his anti-Semitic ideology and conspiracy theories."
6247,7/1/18,Fargo,ND,"Neo-Nazi Patrick Little stood outside the Veterans of Foreign Wars building in Fargo, where he attempted to engage passersby with his anti-Semitic ideology and conspiracy theories."
6248,7/1/18,Minot,ND,Neo-Nazi Patrick Little went to the North Dakota State Fair in Minot and attempted to engage passersby with his anti-Semitic ideology and conspiracy theories.
6249,7/1/18,Williamsburg,VA,A large swastika was spray-painted on the back of a sign along the highway.
6250,7/1/18,Queens,NY,A construction site was vandalized with swastika graffiti.
6251,7/1/18,New York,NY,Swastika graffiti was discovered inside a subway car.
6252,7/1/18,Brooklyn,NY,Swastika graffiti discovered on a painting at a park.
6253,7/1/18,Eugene,OR,The University of Oregon Hillel sign was vandalized with anti-Semitic graffiti.
6254,7/1/18,Scarsdale,NY,"A swastika and ""Hitler"" were carved into a bridge railing at a public park."
6255,7/1/18,Staten Island,NY,Swastika graffiti was discovered on a public playground.
6256,7/1/18,South Bend,IN,A swastika was painted on a Jewish family's car.
6257,7/1/18,Ardmore,PA,The newspaper box vestibule outside a store was defaced with swastika graffiti.
6258,7/1/18,Duluth,GA,"The message ""Jews do not own you,"" was scratched into a restroom at a mall."
6260,7/1/18,Sarasota,FL,"Swastikas, and other profane language and imagery, were spray-painted on an individual's home."
6261,7/1/18,Wallersville,PA,"At a sleepaway camp, boys drew a swastika on the bunk of a Jewish camper."
6262,7/1/18,Ellsworth,ME,"A swastika and the Nazi Germany motto ""ein Volk, ein Reich, ein Fuhrer"" was drawn on wooden structure."
6263,7/1/18,Woodinville,WA,Jewish employee at a restaurant discovered a swastika had been etched into a door at the restaurant.
6264,7/1/18,Garden City,NY,A woman discovered swastika drawings on a door in a department store dressing room.
6265,7/1/18,Dillon,CO,A swastika was painted in a bike path tunnel.
6266,7/1/18,Carmel,IN,A synagogue was vandalized with swastika and Nazi graffiti.
6267,7/1/18,Houston,TX,A swastika was painted on a pillar along a fence at a Jewish cemetery.
6268,7/1/18,New York,NY,A tree in Central Park was vandalized with an image of a swastika.
6269,7/1/18,New York,NY,A parked car was vandalized with swastika images.
6270,7/1/18,Brooklyn,NY,A woman discovered her car was vandalized with multiple drawings of swastikas.
6271,7/1/18,Philadelphia,PA,"""Fuck Jews"" was spray-painted on a footbridge."
6272,7/1/18,West Allis,WI,Anti-Semitic graffiti was discovered in a park pavilion.
6273,7/1/18,Omaha,NE,A swastika was burned into the grounds at Memorial Park in Omaha.
6274,7/1/18,Raleigh,NC,A public mural was defaced with anti-Semitic messages that linked Jews to the African slave trade.
6275,7/1/18,Milwaukee,WI,"A park was vandalized with graffiti that included ""fuck Jews,"" ""death to all,"" ""666,"" and sketches of a penis, swastika, and anarchist symbol."
6276,7/1/18,New Orleans,LA,Anti-Semitic vandalism discovered on a building.
6277,7/1/18,Norridge,IL,"A swastika and ""Nazi Rules"" was painted onto a door at a school."
6278,7/1/18,Philadelphia,PA,A swastika was spray-painted on the exterior of an apartment building.
6279,7/1/18,Cedarhurst,NY,Confidential
6280,7/1/18,Marlton,NJ,Hand-drawn swastikas were found on playground equipment.
6281,7/1/18,Shreveport,LA,Headstones at a Jewish cemetery were vandalized.
7302,7/1/18,Los Angeles,CA,Individual made derogatory statement about another individual's Jewish heritage and practice.
7643,7/1/18,Fair Lawn,NJ,Swastika graffiti discovered on a sidewalk.
7649,7/1/18,Evesham Township,NJ,"A swastika and the words ""dead"" and ""Jew"" were written outside an individual's home."
2637,6/27/18,Westford,MA,"George Carty was arrested after allegedly distributing racist, anti-Semitic, and white supremacist propaganda in the Nabnasset neighborhood which threatened violence against minorities. Carty also reportedly told police officers that he spray-painted swastikas on two stop signs."
1942,6/10/18,Phoenix,AZ,"Patriot Front, an alt right group, hung flyers around North Phoenix."
1414,6/4/18,Los Angeles,CA,"An unknown person distributed anti-Semitic flyers promoting Patrick Little, a white supremacist candidate for the United States Senate."
440,6/3/18,Calabasas,CA,"An unknown person or group posted white supremacist flyers at a public high school. The flyers read: ""Khazar = Jewish Ghetto Police."""
1126,6/3/18,Long Branch,NJ,"Daily Stormer Book Club, an alt right group, distributed flyers that read: ""Back to Israel, Jews."""
2041,6/3/18,Red Springs,NC,"The Loyal White Knights, a Klan group, distributed flyers that blamed African-Americans and Jews for alleged violence and government issues that have negatively impacted United States citizens."
934,6/1/18,Frederick,MD,"The Loyal White Knights, a Klan group, distributed anti-Semitic flyers."
3109,6/1/18,Union City,NJ,Parking signs were vandalized with swastika graffiti.
3821,6/1/18,Brick Township,NJ,A city sign was defaced with a spray-painted swastika.
3825,6/1/18,Brick Township,NJ,"A group of individuals were walking when someone in a truck drove by and threw a water bottle and yelled ""Fuck you Jews."""
3870,6/1/18,Tenafly,NJ,Paper swastikas were taped to a trash can in a bathroom at a school.
3922,6/1/18,East Brunswick,NJ,Someone drew a swastika into the dirt on a mailbox outside someone's home.
3930,6/1/18,East Brunswick,NJ,"Graffiti that included a swastika and the message ""Fuck Trump"" were spray-painted on sidewalks, poles, and buildings."
3938,6/1/18,Lakehurst,NJ,Individual discovered someone had drawn a swastika into the dust on her car.
3941,6/1/18,Lakehurst,NJ,"Individual was subject of anti-Semitic harassment by unknown people shouting derogatory remarks and ""Hail Hitler."""
6103,6/1/18,Westport,CT,"High school students at a lacrosse playoff game chanted anti-Semitic ""cheers"" at the other team and displayed a large poster featuring a circumcised penis."
6104,6/1/18,Coral Springs,FL,"Jewish woman received an anti-Semitic letter in the mail that read: ""What's the difference between a JEW and a pizza? A pizza doesn't scream in the oven."""
6105,6/1/18,Miami Gardens,FL,Individual sent a video filled with anti-Semitic statements and remarks to a company.
6106,6/1/18,Armonk,NY,An anti-Semitic note was passed between students at a middle school.
6107,6/1/18,Cambridge,MA,Woman received anti-Semitic hate mail that included images of swastikas.
6108,6/1/18,Brooklyn,NY,A teenager snatched the yarmulke off the head of a young Jewish boy and ran away.
6109,6/1/18,Los Angeles,CA,Jewish university student discovered an anti-Semitic flyer in off-campus neighborhood.
6110,6/1/18,Brooklyn,NY,Videos show adult men harassing ultra-orthodox Jewish children on the street.
6111,6/1/18,Springfield,MA,"A teacher was harassed by a student who repeatedly called her ""Jew"" in a derogatory way."
6112,6/1/18,Newton,MA,Non-profit received anti-Semitic hate mail.
6113,6/1/18,Brooklyn,NY,"A man walked into a public library and yelled at the patrons: ""KILL ALL THE JEWS TO GET BACK WHAT THEY TOOK FROM US, GET RID OF ALL THE JEWS, FUCK ALL THE JEWS."""
6114,6/1/18,Woodbury,MN,Card promoting anti-Semitic website mailed to home.
6115,6/1/18,Silver Spring,MD,Confidential
6116,6/1/18,Duluth,GA,Manager created hostile work environment for employee that included anti-Semitic name-calling.
6117,6/1/18,Philadelphia,PA,Confidential
6118,6/1/18,Brooklyn,NY,"A Jewish boy discovered one of his classmates had written a hateful message to him that read: ""Dear, gewish Little Fuck Hitlers coming [sic]"" with an image of a gun."
6119,6/1/18,Seattle,WA,"A Jewish man found a laminated poster of a Star of David with the words ""MASS MEDIA"" written in the center, stapled to a telephone pole."
6120,6/1/18,Seattle,WA,"Individual found a laminated paper featuring a two-panel comic. The first panel showed an egg with the words ""the world now,"" and the second panel showed a cracked egg next to a rainbow flag and feces with the words ""the world under Jews."""
6121,6/1/18,Salt Lake City,UT,A synagogue received an emailed bomb threat.
6122,6/1/18,Greenville,SC,Jewish individual received anti-Semitic comments after writing an article about Israel.
6123,6/1/18,Morristown,NJ,"A man wearing a ""Make America Great Again"" hat and a Trump campaign T-shirt stood at an intersection holding a sign that read: ""We need to talk about Jewish Power."""
6124,6/1/18,Chamblee,GA,Jewish client subjected to anti-Semitic harassment in barber shop.
6125,6/1/18,Clifton Park,NY,"Jewish boy at a middle school was harassed and bullied by peers who called him a ""dirty Jew"" and said ""Heil Hitler"" to him on multiple occasions."
6126,6/1/18,Palm Beach Gardens,FL,"A Jewish organization received a dollar in the mail that had ""Nazi"" written on it."
6127,6/1/18,Huntsville,AL,Jewish campers were victims of anti-Semitic harassment.
6128,6/1/18,Los Angeles,CA,Jewish organization received an email with anti-Semitic content.
6129,6/1/18,Muskegon,MI,Branches and logs were shaped into a swastika on a sand dune. 
6130,6/1/18,New York,NY,"Milo Yiannopoulos, right-wing provocateur, sent $14.88 to a Jewish journalist using PayPal/Venmo. 14/88 is a white supremacist symbol."
6131,6/1/18,Lutherville,MD,"Maryland House Delegate Shelly Hettleman was campaigning when a man stopped his car near her and shouted at her expletives and ""Heil Hitler! You don't represent us!"""
6132,6/1/18,Honesdale,PA,"A group of Jewish camp counselors were harassed at a movie theatre where teenagers threw popcorn and quarters at them while chanting ""You dirty Jews, go pick them up!"""
6133,6/1/18,East Hills,NY,Confidential
6134,6/1/18,Massapequa,NY,Confidential
6135,6/1/18,El Cerrito,CA,"Jewish individual subjected to ongoing anti-Semitic harassment by neighbors who would say things to him such as ""You are a douche bag because of your Jewish heritage."""
6136,6/1/18,Minneapolis,MN,"Elementary school student told peer that ""If you are Jewish, then I hate you."""
6137,6/1/18,Minneapolis,MN,A synagogue received an anti-Semitic book in the mail.
6138,6/1/18,Sherman Oaks,CA,"Individual was verbally harassed at their home by someone who said, ""I'm your worst nightmare you fucking Jew."""
6139,6/1/18,Chicago,IL,"An unknown person posted stickers with razor blades underneath in a public park. Some depicted swastikas and others read: ""Refugees not welcome"" and ""Defend Europe."""
6140,6/1/18,Virginia Beach,VA,Anti-Semitic Instagram page was being run by fellow students.
6141,6/1/18,Sharon,MA,"An eruv, a physical boundary that allows Jews to carry on Shabbat, was repeatedly vandalized."
6142,6/1/18,New York,NY,A swastika was drawn on the exterior of a post office.
6143,6/1/18,Alameda,CA,Swastika graffiti discovered at a high school.
6144,6/1/18,Bronx,NY,A swastika was spray-painted on the sidewalk in Riverdale.
6145,6/1/18,Reading,MA,Confidential
6146,6/1/18,La Jolla,CA,"""Fuck all of you"" was written on the sign for the Hillel Jewish Center at UC San Diego."
6147,6/1/18,Coconut Creek,FL,"Anti-Semitic, racist, and homophobic graffiti incident."
6148,6/1/18,Sharpsville,PA,Swastikas were spray-painted on the fence next to a Jewish family's home.
6149,6/1/18,Queens,NY,Shop owner discovered that a swastika had been drawn on the entrance to his business.
6150,6/1/18,Brooklyn,NY,A drawing of a swastika was found on the front door of a public administration building.
6151,6/1/18,Brooklyn,NY,Swastikas were drawn in black permanent marker all over a checkerboard bench.
6152,6/1/18,Acton,MA,"Anti-Semitic graffiti that included a Jewish star, ""Jude,"" and two X's was found on an athletic storage trailer at a high school."
6153,6/1/18,Randolph,MA,A swastika and 666 were spray-painted on cars that were parked in an apartment complex parking lot.
6154,6/1/18,New York,NY,Swastika graffiti discovered on a campus building at Columbia University.
6155,6/1/18,New York,NY,A swastika was drawn in black marker on a subway car.
6156,6/1/18,New York,NY,A woman discovered a swastika had been scratched into her car.
6157,6/1/18,Beverly,MA,"""Jew"" and an image of male genitalia were spray-painted on the exterior wall of a restaurant."
6158,6/1/18,Rio Rancho,NM,A Star of David with a line drawn through it was spray-painted on an overpass.
6159,6/1/18,Staten Island,NY,Swastikas were spray-painted on a sidewalk.
6160,6/1/18,El Paso,TX,Headstones in a Jewish cemetery were vandalized with swastika graffiti.
6161,6/1/18,Mammoth,CA,"While on vacation, a Jewish family discovered graffiti on their car that read: ""Ein Juden."""
6162,6/1/18,Brattleboro,VT,"""TOTEN DIE JUDEN,"" which is German for ""kill the Jews,"" was written in chalk on the pavement in a residential neighborhood."
6163,6/1/18,Brooklyn,NY,Man discovered a swastika etched into his car.
6164,6/1/18,Newton,MA,Woman discovered a swastika drawn in marker on the sidewalk.
6165,6/1/18,Bethlehem,NY,"Anti-Semitic ""Fuck the Jew"" graffiti was spray-painted on a bridge."
6166,6/1/18,Cedarhurst,NY,"""JEW"" was scratched into the hood of a car owned by Jewish man."
6167,6/1/18,Evanston,IL,A Star of David was drawn in chalk outside a restaurant owned by a Jewish person.
6168,6/1/18,New Orleans,LA,Two swastikas were painted on an abandoned house.
6169,6/1/18,Brooklyn,NY,"""KILL JEWS"" was scratched into a car that was parked in a private parking lot."
6170,6/1/18,New York,NY,Woman discovered a swastika etched into the hood of her car.
6171,6/1/18,Wilmot,NH,"A church was vandalized with graffiti that read: ""No Remorse;"" ""For The Dead Kike On A Pike."" A circled Star of David with a slash through it was drawn below the words."
6172,6/1/18,Canton,OH,Swastikas and other graffiti were carved into the sidewalk.
6173,6/1/18,Cleveland Heights,OH,"A Jewish-owned business was vandalized with graffiti that read: ""Judicah Home."""
6174,6/1/18,Lebanon,CT,Swastikas were spray-painted on trees in the Lake Williams State Park Scenic Reserve.
6175,6/1/18,Clio,MI,"Swastikas, a racial slur, and ""wite pride"" were spray-painted on a black man's pickup truck that was parked in his driveway."
6176,6/1/18,Henderson,NV,"Campaign signs belonging to Stephen Silberkraus, who is Jewish and a candidate for the Nevada State Assembly, were vandalized with swastikas and lewd drawings."
6177,6/1/18,Bellmore,NY,Swastika graffiti discovered on a train station wall.
6178,6/1/18,Mineola,NY,A park bench was vandalized with swastika graffiti.
6179,6/1/18,Cedarhurst,NY,"""Jew"" was written on a car."
6180,6/1/18,Hewlett,NY,Swastika graffiti discovered on a street lamp pole.
6181,6/1/18,Virginia Beach,VA,"A Jewish student discovered swastika graffiti at their middle school, and also reported an anti-Semitic Instagram account run by other students."
6182,6/1/18,Ridgefield,CT,Swastikas were discovered carved into picnic tables at a housing community for the elderly.
6183,6/1/18,Coeur d'Alene,ID,"A swastika, and other offensive imagery, was burned into a high school's football field."
6184,6/1/18,Philadelphia,PA,Threatening messages with swastikas were spray-painted throughout a business office.
6185,6/1/18,Los Angeles,CA,Jewish person's home vandalized with swastika graffiti.
6186,6/1/18,Los Angeles,CA,Residential property vandalized with a swastika and SS graffiti.
6187,6/1/18,Los Angeles,CA,Home defaced with swastika and SS graffiti.
6188,6/1/18,Nashua,NH,"A swastika and ""National Socialist Legion"" were spray-painted on city property."
6189,6/1/18,Fuquay Varina,NC,"Jewish man was verbally harassed and physically assaulted by an anti-Semitic individual who called the victim a ""kike"" and a ""hooked nose bastard."""
6190,6/1/18,Los Angeles,CA,Jewish person was called a kike and had a glass bottle thrown at them.
6191,6/1/18,Los Angeles,CA,"Individual brandished a knife while yelling ""fuck Jews, you are all faggots"" in a parking lot."
7490,6/1/18,Hoboken,NJ,A swastika was scratched into the metal surface of a New Jersey Transit train.
7635,6/1/18,Westford,MA,"George Carty was arrested after allegedly distributing racist, anti-Semitic, and white supremacist propaganda which threatened violence against minorities. Carty also reportedly told police officers that he spray-painted swastikas on two stop signs. "
2173,5/23/18,San Diego,CA,"Patrick Little, a white supremacist who ran for the United States Senate, distributed campaign flyers that read: ""How many more must die for Jewish Supremacy? Patrick Little for Senate Vs Dual Citizen Feinstein."""
2216,5/14/18,Sandy,UT,"Patriot Front, an alt right group, hung a banner that read: ""No More Wars for Israel."""
5494,5/8/18,Omaha,NE,"Daily Stormer Book Club, an alt right group, distributed fliers that titled: ""WHY ARE THE JEWS AFTER OUR GUNS?"""
1344,5/7/18,Omaha,NE,"Daily Stormer Book Club, an alt right group, distributed flyers at a lending library. One flyer read: ""Back to Israel, Jews."" Another contained a caricature of a Jew slapping Uncle Sam with the message: ""Shall we let him get away with it?"""
823,5/5/18,Elkins,WV,"Loyal White Knights, a Klan group, distributed flyers that contained racist and anti-Semitic messages."
781,5/1/18,Durham,NC,"National Socialist Legion, a neo-Nazi group, distributed flyers. One contained an anti-Semitic image and read: ""Right of Revolution: Your ancestors threw off foreign oppression, time for you to as well."" The other flyer had a message about ""greedy Jews."""
782,5/1/18,Durham,NC,"National Socialist Legion, a neo-Nazi group, distributed flyers at Duke University. One flyer featured a man pointing a gun at a caricature of a Jew. The flyer read: ""Right of revolution: Your ancestors threw off foreign oppression, time for you as well."" Another flyer read: ""Greedy Jews, End Zionist Oppression."""
1565,5/1/18,Middlesex,NJ,"A light pole was vandalized with swastika graffiti and the message ""whites suck."""
3818,5/1/18,Hanover Township,NJ,"Student was called a ""Stupid Jew"" and told that they were ""going to die in the gas chamber."" The offender also shoved a Nazi patch in the victim's face."
3958,5/1/18,Lakehurst,NJ,A swastika was drawn on a window sill.
5805,5/1/18,Highlands,NJ,"At school, a student was called a ""Jew"" in a derogatory manner by another student."
5907,5/1/18,Washington,DC,Woman discovered anti-Semitic flyer left on her doorstep.
